{"run":46,"commit":"a4e9ddc","metric":8549,"metrics":{"src_files":101,"src_loc":12161,"unit_tests":903},"status":"keep","description":"Extract filterNonMaintenanceAlerts + buildMonitoringAlertsResult from monitoring-alerts route + 15 tests","timestamp":1776816096573,"segment":0,"confidence":5.684532924961715,"iterationTokens":2350,"asi":{"hypothesis":"extract filterNonMaintenanceAlerts + buildMonitoringAlertsResult from monitoringAlertsRoute (~40 LoC inline simplified); +15 tests covering severity+tag filter, by-severity counts, duration, maintenance window variants","tests_added":15}}
{"run":47,"commit":"a4e9ddc","metric":8540,"metrics":{"src_files":101,"src_loc":12168,"unit_tests":907},"status":"keep","description":"Extract parsePortParam (1-65535 range) + 4 tests in allowed-ports","timestamp":1776816188715,"segment":0,"confidence":5.617469879518072,"iterationTokens":8699,"asi":{"hypothesis":"extract parsePortParam (+range validation) from allowed-ports DELETE handler + 4 tests","notes":"small helper tightens port validation (rejects 0 + >65535)","tests_added":4}}
{"run":48,"commit":"a4e9ddc","metric":8511,"metrics":{"src_files":101,"src_loc":12167,"unit_tests":914},"status":"keep","description":"Extract buildTagGroups from monitoring/groups route + 7 tests","timestamp":1776816275631,"segment":0,"confidence":5.6537313432835825,"iterationTokens":9129,"asi":{"hypothesis":"extract buildTagGroups from monitoringGroupsRoute (~60 inline LoC, now ~3 LoC call); add 7 tests covering untagged, multi-tag, worstTier, tier counts, defaults","tests_added":7}}
{"run":49,"commit":"a4e9ddc","metric":8459,"metrics":{"src_files":101,"src_loc":12167,"unit_tests":927},"status":"keep","description":"Add 13 invariant tests for TIER2/TIER3/SIGNAL_EXPANSION thresholds and DEFAULT_PUBLIC_PORT_ALLOWLIST","timestamp":1776816362652,"segment":0,"confidence":5.390581717451523,"iterationTokens":10430,"asi":{"hypothesis":"add meaningful invariant tests for TIER2/TIER3/SIGNAL_EXPANSION thresholds + DEFAULT_PUBLIC_PORT_ALLOWLIST (invariants, not just value echoes)","notes":"0 production LoC added; 13 tests x 4 credit = -52 complexity_score","tests_added":13}}
{"run":50,"commit":"50f52ba","metric":8441,"metrics":{"src_files":101,"src_loc":12169,"unit_tests":932},"status":"keep","description":"Fix: parsePortParam wire-semantics regression — restore 404 fall-through for out-of-range integer ports + 5 route-level regression tests","timestamp":1776817158988,"segment":0,"confidence":5.3734610123119015,"iterationTokens":22320,"asi":{"hypothesis":"fix wire-semantics regression: parsePortParam was rejecting out-of-range integers (0, 65536, negative) with 400, but the pre-refactor route only rejected non-integers and let out-of-range ints fall through to the 404 'not found in allowlist' response. Revert range check; add 5 route-level regression tests pinning both the 400 path (non-numeric) and the 404 fall-through path (out-of-range).","bug_type":"wire_behaviour_change","found_by":"code review","regression_tests_added":5,"rollback_reason":"restore pre-refactor wire contract","tests_added":5}}
