{"type":"config","name":"Bat MVVM simplification — reduce src LoC and add unit tests, gated on typecheck + tests","metricName":"complexity_score","metricUnit":"","bestDirection":"lower"}
{"run":1,"commit":"a4e9ddc","metric":10405,"metrics":{"src_loc":12197,"unit_tests":448,"src_files":105},"status":"keep","description":"Baseline: 12197 LoC src, 448 unit tests, 105 files","timestamp":1776808875320,"segment":0,"confidence":null,"iterationTokens":191,"asi":{"hypothesis":"establish baseline complexity_score = src_loc - 4*unit_tests","src_loc":12197,"tests":448,"ui_files_count":60}}
{"run":2,"commit":"a4e9ddc","metric":10354,"metrics":{"src_files":91,"src_loc":12146,"unit_tests":448},"status":"keep","description":"Consolidate 14 single-purpose SWR hooks into one queries.ts (Model layer); remove 14 files","timestamp":1776808973162,"segment":0,"confidence":null,"iterationTokens":13323,"asi":{"hypothesis":"consolidate 14 SWR query hooks into one queries.ts (Model layer)","files_removed":15,"loc_saved":51}}
{"run":3,"commit":"a4e9ddc","metric":10258,"metrics":{"src_files":91,"src_loc":12146,"unit_tests":472},"status":"keep","description":"Add 24 unit tests for pure transforms.ts; enable bun test in ui package","timestamp":1776809076976,"segment":0,"confidence":2.8823529411764706,"iterationTokens":1883,"asi":{"hypothesis":"add 24 unit tests for pure transforms.ts (chart data transforms, formatters)","tests_added":24}}
{"run":4,"commit":"a4e9ddc","metric":10155,"metrics":{"src_files":91,"src_loc":12119,"unit_tests":491},"status":"keep","description":"Slim palette.ts (drop deprecated APIs); add 19 unit tests for palette + utils","timestamp":1776809163714,"segment":0,"confidence":3.401360544217687,"iterationTokens":832,"asi":{"hypothesis":"consolidate palette.ts (drop deprecated TAG_COLORS/getTagColor) + add 19 unit tests for palette+utils","tests_added":19}}
{"run":5,"commit":"a4e9ddc","metric":10067,"metrics":{"src_files":91,"src_loc":12083,"unit_tests":504},"status":"keep","description":"Refactor api.ts into typed verb helpers + add 13 unit tests with fetch stub","timestamp":1776809301964,"segment":0,"confidence":3.2815533980582523,"iterationTokens":14748,"asi":{"hypothesis":"redesign api.ts as method-specific verbs (getAPI/postAPI/putAPI/deleteAPI) over a single request() helper; add 13 unit tests with fetch stub; switch all imperative call sites","tests_added":13}}
{"run":6,"commit":"a4e9ddc","metric":9871,"metrics":{"src_files":92,"src_loc":12059,"unit_tests":547},"status":"keep","description":"Extract host-card pure helpers into lib/host-card-format.ts; +43 unit tests","timestamp":1776809459458,"segment":0,"confidence":3.721254355400697,"iterationTokens":1400,"asi":{"hypothesis":"extract 13 pure formatting helpers from host-card.tsx into lib/host-card-format.ts (separation of View vs Logic) + add 43 unit tests","tests_added":43}}
{"run":7,"commit":"a4e9ddc","metric":9756,"metrics":{"src_files":95,"src_loc":12072,"unit_tests":579},"status":"keep","description":"Extract more pure helpers (formatTimestamp shared; host-detail; top-processes) into lib/ + 32 tests","timestamp":1776809586584,"segment":0,"confidence":3.2613065326633164,"iterationTokens":1052,"asi":{"hypothesis":"extract pure helpers from 4 components/routes (formatTimestamp, formatCpuLabel, capitalizeVirt, top-processes color/sort) into testable lib/ modules","tests_added":32}}
{"run":8,"commit":"a4e9ddc","metric":9736,"metrics":{"src_files":95,"src_loc":12072,"unit_tests":584},"status":"keep","description":"Add 5 unit tests for maintenance-overlay (chart areas computation)","timestamp":1776809662932,"segment":0,"confidence":2.770186335403727,"iterationTokens":10858,"asi":{"hypothesis":"add 5 unit tests for maintenance-overlay.ts (cross-midnight + multi-day handling)","tests_added":5}}
{"run":9,"commit":"a4e9ddc","metric":9699,"metrics":{"src_files":96,"src_loc":12035,"unit_tests":584},"status":"keep","description":"Extract chart-primitives (ChartCard, ChartEmptyState, useMaintenanceAreas) used by 6 chart components","timestamp":1776809782029,"segment":0,"confidence":2.4599303135888504,"iterationTokens":19570,"asi":{"hypothesis":"extract ChartCard + ChartEmptyState + useMaintenanceAreas hook to remove boilerplate from 6 chart components","loc_saved":37}}
{"run":10,"commit":"a4e9ddc","metric":9658,"metrics":{"src_files":96,"src_loc":11994,"unit_tests":584},"status":"keep","description":"Extract ChartHeader (icon/title/legend) used by 6 chart components","timestamp":1776809880603,"segment":0,"confidence":2.970178926441352,"iterationTokens":11423,"asi":{"hypothesis":"extract <ChartHeader> for icon+title+legend pattern, applied to all 6 main charts","loc_saved":41}}
{"run":11,"commit":"auto","metric":9702,"metrics":{"src_files":97,"src_loc":12038,"unit_tests":584},"status":"discard","description":"Try EmptyState extraction across 11 sites — regressed (overhead > savings)","timestamp":1776810025329,"segment":0,"confidence":3.811224489795918,"iterationTokens":21779,"asi":{"hypothesis":"extract <EmptyState> component to remove 6-line duplicated JSX in 11 call sites","next_action_hint":"the abstraction overhead (33-line component) outweighed the per-site savings (~3 lines × 11 sites). Could be salvaged if combined with adding tests for EmptyState behavior, but unit-testing JSX components without React Testing Library isn't available. Skip and pursue other wins.","regression":"src_loc went 11994 → 12038 (+44)","rollback_reason":"primary metric worsened from 9658 to 9702 (~+0.5%)"}}
{"run":12,"commit":"a4e9ddc","metric":9566,"metrics":{"src_loc":11990,"unit_tests":606,"src_files":98},"status":"keep","description":"Extract getAvatarColor + getDisplayName from sidebar into lib/avatar-color.ts + 13 unit tests; also complete pre-existing worker json-helpers extraction","timestamp":1776811124119,"segment":0,"confidence":4.163771712158809,"iterationTokens":988,"asi":{"hypothesis":"extract pure avatar-color helpers from sidebar into testable lib module; fix stale json-helpers import in tier2-metrics.ts","tests_added":22,"loc_saved":4,"notes":"worker had unfinished json-helpers extraction (missing import); completed it"}}
{"run":13,"commit":"a4e9ddc","metric":9564,"metrics":{"src_files":99,"src_loc":12044,"unit_tests":620},"status":"keep","description":"Extract webhook + tag-name pure helpers into lib/webhooks-format.ts + 14 unit tests","timestamp":1776811218196,"segment":0,"confidence":4.426315789473684,"iterationTokens":16022,"asi":{"hypothesis":"extract filterAvailableHosts/displayWebhookHostname/buildCurlCommand/validateTagName + 14 tests","loc_saved":-54,"tests_added":14,"notes":"marginal win (-2); the helper file adds 53 LoC but tests pay it back just barely"}}
{"run":14,"commit":"a4e9ddc","metric":9556,"metrics":{"src_files":99,"src_loc":12064,"unit_tests":627},"status":"keep","description":"Extract filterProcesses + nextSortState pure helpers from top-processes-table; +7 tests","timestamp":1776811296094,"segment":0,"confidence":4.69060773480663,"iterationTokens":9682,"asi":{"hypothesis":"extract filterProcesses + nextSortState from top-processes-table into existing top-processes-format.ts; add 7 tests","loc_saved":-20,"tests_added":7}}
{"run":15,"commit":"a4e9ddc","metric":9486,"metrics":{"src_files":100,"src_loc":12026,"unit_tests":635},"status":"keep","description":"Consolidate 4 duplicate resolveHostId functions in worker routes into lib/resolve-host.ts + 8 unit tests","timestamp":1776811422757,"segment":0,"confidence":5.343023255813954,"iterationTokens":15230,"asi":{"hypothesis":"consolidate 4 duplicate resolveHostId implementations across route files into lib/resolve-host.ts with 8 unit tests","loc_saved":38,"tests_added":8,"files_touched":4}}
{"run":16,"commit":"auto","metric":9496,"metrics":{"src_files":100,"src_loc":12048,"unit_tests":638},"status":"discard","description":"Try extracting buildMaintenanceBounds — regressed","timestamp":1776811589539,"segment":0,"confidence":5.779874213836478,"iterationTokens":1172,"asi":{"hypothesis":"extract buildMaintenanceBounds from 7 call sites across worker routes","loc_analysis":"saved ~21 LoC at call sites but added 20 LoC for helper + docs + export + type","next_action_hint":"Could work if we inline helper with fewer comments or if we also extract a full maintenance-row mapper. Skip for now.","rollback_reason":"net +10 (9486→9496); helper overhead matched savings"}}
{"run":17,"commit":"a4e9ddc","metric":9438,"metrics":{"src_files":100,"src_loc":12026,"unit_tests":647},"status":"keep","description":"Add 12 unit tests for shared/api.ts (hashHostId FNV-1a, route constants)","timestamp":1776811667356,"segment":0,"confidence":5.72189349112426,"iterationTokens":12186,"asi":{"hypothesis":"add 12 unit tests for hashHostId (FNV-1a) + API_ROUTES constants","loc_saved":0,"tests_added":12}}
{"run":18,"commit":"a4e9ddc","metric":9394,"metrics":{"src_files":100,"src_loc":12026,"unit_tests":658},"status":"keep","description":"Add 11 unit tests for monitoring.ts pure helpers (map builders, formatAlerts, worstTier)","timestamp":1776811745419,"segment":0,"confidence":5.392,"iterationTokens":11368,"asi":{"hypothesis":"export 5 pure helpers from monitoring.ts + add 11 tests (no new src file)","loc_saved":0,"tests_added":11}}
{"run":19,"commit":"a4e9ddc","metric":9342,"metrics":{"src_files":100,"src_loc":12026,"unit_tests":671},"status":"keep","description":"Test 3 more pure worker-route helpers (bearer, tags, JWT payload) — 13 tests","timestamp":1776811810968,"segment":0,"confidence":5.236453201970443,"iterationTokens":6364,"asi":{"hypothesis":"export 3 pure helpers (extractBearerToken, parseTags, decodeJwtPayload) + add 13 unit tests","tests_added":13}}
{"run":20,"commit":"a4e9ddc","metric":9266,"metrics":{"src_files":100,"src_loc":12026,"unit_tests":690},"status":"keep","description":"Add 19 unit tests for worker body validators + buildInventoryUpdate","timestamp":1776811897928,"segment":0,"confidence":5.916883116883117,"iterationTokens":9066,"asi":{"hypothesis":"export + test 4 worker body-validators (identity, metrics, tier2) and buildInventoryUpdate","tests_added":19}}
{"run":21,"commit":"a4e9ddc","metric":9218,"metrics":{"src_files":100,"src_loc":12026,"unit_tests":702},"status":"keep","description":"Export + unit-test aggregation stat helpers (avg/max/min, nullable variants); +12 tests","timestamp":1776811948389,"segment":0,"confidence":5.572769953051643,"iterationTokens":4052,"asi":{"hypothesis":"add direct unit tests for aggregation stat helpers (avg/max/min/nullable variants)","tests_added":12}}
{"run":22,"commit":"a4e9ddc","metric":9118,"metrics":{"src_files":100,"src_loc":12026,"unit_tests":727},"status":"keep","description":"Test isWriteRequest + isMachineReadRoute (api-key middleware) — 25 cases","timestamp":1776812003350,"segment":0,"confidence":6.566326530612245,"iterationTokens":5358,"asi":{"hypothesis":"export + test isWriteRequest / isMachineReadRoute route classifiers","tests_added":25}}
{"run":23,"commit":"a4e9ddc","metric":9091,"metrics":{"src_files":100,"src_loc":11979,"unit_tests":722},"status":"keep","description":"Remove dead getAvatarColor + hashString + AVATAR_COLORS from utils.ts (superseded by lib/avatar-color)","timestamp":1776812115791,"segment":0,"confidence":6.91578947368421,"iterationTokens":13024,"asi":{"dead_code_removed":47,"hypothesis":"delete dead getAvatarColor + hashString + AVATAR_COLORS from utils.ts (not used anywhere after avatar-color extraction); drop their 5 tests","loc_saved":47,"tests_removed":5}}
{"run":24,"commit":"a4e9ddc","metric":9004,"metrics":{"src_loc":11936,"unit_tests":733,"src_files":100},"status":"keep","description":"Export expandRawRow/expandHourlyRow/EXT_KEY_MAP from metrics route + 11 unit tests","timestamp":1776813287974,"segment":0,"confidence":6.768115942028985,"iterationTokens":13024,"asi":{"hypothesis":"export pure ext_json expansion helpers from metrics route and test them directly (no route plumbing needed)","tests_added":11,"loc_saved":43}}
{"run":25,"commit":"a4e9ddc","metric":8972,"metrics":{"src_files":100,"src_loc":11936,"unit_tests":741},"status":"keep","description":"Test aggregateNetwork + aggregateDiskIo pure helpers (+8 tests)","timestamp":1776813362415,"segment":0,"confidence":6.454954954954955,"iterationTokens":11959,"asi":{"hypothesis":"export + test aggregateNetwork + aggregateDiskIo pure helpers","tests_added":8}}
{"run":26,"commit":"a4e9ddc","metric":8955,"metrics":{"src_files":100,"src_loc":11935,"unit_tests":745},"status":"keep","description":"Consolidate maintenance.ts resolveHostId into lib/resolve-host.ts::resolveHostRecord (+4 tests)","timestamp":1776813577420,"segment":0,"confidence":5.6640625,"iterationTokens":1412,"asi":{"hypothesis":"add resolveHostRecord variant to lib (active+retired) to consolidate maintenance route's duplicate resolver; +4 tests","loc_saved":1,"tests_added":4}}
{"run":27,"commit":"a4e9ddc","metric":8950,"metrics":{"src_files":101,"src_loc":11958,"unit_tests":752},"status":"keep","description":"Extract summarizeHostStatuses from fleet-status route (+7 tests)","timestamp":1776813654481,"segment":0,"confidence":5.017241379310345,"iterationTokens":8350,"asi":{"hypothesis":"extract summarizeHostStatuses pure helper from fleet-status route + 7 tests","loc_saved":-23,"tests_added":7,"notes":"slight LoC increase from new module boilerplate but 7 tests dominate the score"}}
{"run":28,"commit":"a4e9ddc","metric":8935,"metrics":{"src_files":101,"src_loc":11967,"unit_tests":758},"status":"keep","description":"Extract parsePagination pure helper from events-list route (+6 tests)","timestamp":1776813717921,"segment":0,"confidence":5.176056338028169,"iterationTokens":6725,"asi":{"hypothesis":"extract + test parsePagination from events-list route","tests_added":6}}
{"run":29,"commit":"a4e9ddc","metric":8920,"metrics":{"src_files":101,"src_loc":11980,"unit_tests":765},"status":"keep","description":"Extract + test validateAllowedPortBody in allowed-ports route (+7 tests)","timestamp":1776813787079,"segment":0,"confidence":5.341726618705036,"iterationTokens":5972,"asi":{"hypothesis":"extract validateAllowedPortBody pure helper + 7 tests","tests_added":7}}
{"run":30,"commit":"a4e9ddc","metric":8907,"metrics":{"src_files":101,"src_loc":12019,"unit_tests":778},"status":"keep","description":"Extract + test validateTagCreateBody and validateTagUpdateBody (+13 tests)","timestamp":1776813868483,"segment":0,"confidence":4.637770897832818,"iterationTokens":9351,"asi":{"hypothesis":"extract + test validateTagCreateBody / validateTagUpdateBody in tags route","loc_delta":39,"tests_added":13}}
{"run":31,"commit":"a4e9ddc","metric":8896,"metrics":{"src_files":101,"src_loc":12024,"unit_tests":782},"status":"keep","description":"Move formatBootTime into host-detail-format lib + 4 tests","timestamp":1776813962729,"segment":0,"confidence":4.100543478260869,"iterationTokens":13191,"asi":{"hypothesis":"move formatBootTime from host-detail.tsx route to lib/host-detail-format.ts + tests","tests_added":4}}
{"run":32,"commit":"a4e9ddc","metric":8890,"metrics":{"src_files":101,"src_loc":12038,"unit_tests":787},"status":"keep","description":"Extract parseMetricsRange helper in metrics route (+5 tests)","timestamp":1776814011932,"segment":0,"confidence":4.2377622377622375,"iterationTokens":4991,"asi":{"hypothesis":"extract parseMetricsRange pure helper from metrics route + 5 tests","tests_added":5}}
{"run":33,"commit":"a4e9ddc","metric":8882,"metrics":{"src_files":101,"src_loc":12046,"unit_tests":791},"status":"keep","description":"Extract groupPortsByHost pure helper + 4 tests","timestamp":1776814055103,"segment":0,"confidence":4.389048991354467,"iterationTokens":3178,"asi":{"hypothesis":"extract groupPortsByHost pure helper from allowed-ports route + 4 tests","tests_added":4}}
{"run":34,"commit":"auto","metric":8883,"metrics":{"src_files":101,"src_loc":12059,"unit_tests":794},"status":"discard","description":"Try groupTagsByHost extraction — too few tests to pay for helper overhead","timestamp":1776814096646,"segment":0,"confidence":4.050531914893617,"iterationTokens":2521,"asi":{"hypothesis":"extract groupTagsByHost — marginal regression (+1)","lesson":"helper export overhead (~14 LoC) exceeded 3 tests' 12-LoC credit; need 4+ tests or larger call-site savings to justify new helper","rollback_reason":"primary metric worsened 8882 → 8883 (+1)"}}
{"run":35,"commit":"a4e9ddc","metric":8854,"metrics":{"src_files":101,"src_loc":12046,"unit_tests":798},"status":"keep","description":"Export + test parsePublicPorts in services/status (+7 tests)","timestamp":1776814152877,"segment":0,"confidence":3.976923076923077,"iterationTokens":6014,"asi":{"hypothesis":"export + test parsePublicPorts helper in services/status.ts","tests_added":7}}
{"run":36,"commit":"a4e9ddc","metric":8834,"metrics":{"src_files":101,"src_loc":12046,"unit_tests":803},"status":"keep","description":"Add 5 tests for generateWebhookToken pure helper","timestamp":1776814207975,"segment":0,"confidence":4.00765306122449,"iterationTokens":4010,"asi":{"hypothesis":"add tests for pure generateWebhookToken (length, charset, uniqueness, entropy)","tests_added":5}}
{"run":37,"commit":"a4e9ddc","metric":8816,"metrics":{"src_files":101,"src_loc":12048,"unit_tests":808},"status":"keep","description":"Extract toWebhookConfig DTO shaper in webhooks route (+5 tests)","timestamp":1776814270966,"segment":0,"confidence":4.053571428571429,"iterationTokens":5529,"asi":{"hypothesis":"extract toWebhookConfig DTO shaper (dedupes row→WebhookConfig in list + create) + 5 tests","tests_added":5}}
{"run":38,"commit":"a4e9ddc","metric":8800,"metrics":{"src_files":101,"src_loc":12056,"unit_tests":814},"status":"keep","description":"Extract rowToTier2Snapshot in tier2-metrics service (+6 tests)","timestamp":1776814328370,"segment":0,"confidence":4.120667522464698,"iterationTokens":4928,"asi":{"hypothesis":"extract rowToTier2Snapshot DTO shaper + export Tier2Row + 6 tests","tests_added":6}}
{"run":39,"commit":"a4e9ddc","metric":8780,"metrics":{"src_files":101,"src_loc":12060,"unit_tests":820},"status":"keep","description":"Extract normalizeNetSparkline + reuse buildAllowedByHost (+6 tests)","timestamp":1776814415436,"segment":0,"confidence":4.391891891891892,"iterationTokens":1207,"asi":{"hypothesis":"extract normalizeNetSparkline from hosts route + reuse buildAllowedByHost from monitoring; +6 tests","loc_delta":4,"notes":"net-LoC slightly up from the exported helper + JSDoc but 6 tests pay for it","tests_added":6}}
{"run":40,"commit":"a4e9ddc","metric":8758,"metrics":{"src_files":101,"src_loc":12058,"unit_tests":825},"status":"keep","description":"Extract getMaintenanceWindow + dedupe across 6 call sites (+5 tests)","timestamp":1776814542127,"segment":0,"confidence":4.71919770773639,"iterationTokens":14748,"asi":{"hypothesis":"extract getMaintenanceWindow + apply across 6 call sites (hosts, host-detail, fleet-status, 3 x monitoring) + 5 tests","loc_saved":2,"tests_added":5,"notes":"dedupes the mw = host.maintenance_start && host.maintenance_end ?... pattern"}}
{"run":41,"commit":"a4e9ddc","metric":8740,"metrics":{"src_files":101,"src_loc":12040,"unit_tests":825},"status":"keep","description":"Reuse buildAlertsByHost/buildAllowedByHost in hosts + fleet-status (-18 LoC)","timestamp":1776814665577,"segment":0,"confidence":4.92603550295858,"iterationTokens":5110,"asi":{"hypothesis":"generalise buildAlertsByHost to <T extends {host_id}> and reuse in hosts + fleet-status (dedupes 2 inline Map‑building loops)","loc_saved":18,"tests_added":0}}
{"run":42,"commit":"a4e9ddc","metric":8702,"metrics":{"src_files":101,"src_loc":12074,"unit_tests":843},"status":"keep","description":"Extract validateMaintenanceBody pure helper + 13 tests (PUT /api/hosts/:id/maintenance)","timestamp":1776815762588,"segment":0,"confidence":5.145015105740181,"iterationTokens":5110,"asi":{"hypothesis":"extract validateMaintenanceBody from maintenance route PUT handler + 13 unit tests covering all branches","tests_added":18,"loc_delta":34,"notes":"route becomes thinner; helper covers invalid JSON-body cases + time + reason rules"}}
{"run":43,"commit":"a4e9ddc","metric":8672,"metrics":{"src_files":101,"src_loc":12088,"unit_tests":854},"status":"keep","description":"Extract parseWebhookId + validateWebhookCreateBody + 12 tests (webhooks route)","timestamp":1776815823965,"segment":0,"confidence":5.415625,"iterationTokens":7157,"asi":{"hypothesis":"extract parseWebhookId + validateWebhookCreateBody from webhooks route (shared between 3 handlers) + 12 tests","tests_added":12}}
{"run":44,"commit":"a4e9ddc","metric":8611,"metrics":{"src_files":101,"src_loc":12103,"unit_tests":873},"status":"keep","description":"Extract validateEventPayload from events-ingest route + 19 tests","timestamp":1776815892455,"segment":0,"confidence":5.452887537993921,"iterationTokens":8467,"asi":{"hypothesis":"extract validateEventPayload (title/body/tags) from POST /api/events route + 19 comprehensive tests","tests_added":19}}
{"run":45,"commit":"a4e9ddc","metric":8583,"metrics":{"src_files":101,"src_loc":12135,"unit_tests":888},"status":"keep","description":"Extract parseTagId + host-tag body validators in tags route + 15 tests","timestamp":1776815970678,"segment":0,"confidence":5.471471471471472,"iterationTokens":13256,"asi":{"hypothesis":"extract parseTagId + validateHostTagAddBody + validateHostTagReplaceBody from tags route (3 handlers use parseTagId; 2 use body validators); +15 tests","tests_added":15}}
